{
  "version": "0.3.0-local",
  "updatedAt": "2026-05-05T09:35:00+02:00",
  "network": "base-mainnet",
  "purpose": "Local-first discovery registry for Base/OpenClaw agents and projects. Prototype — no external claims.",
  "sources": [
    { "label": "Base AI Agents docs", "url": "https://docs.base.org/ai-agents" },
    { "label": "Base Agent Registration & Identity docs", "url": "https://docs.base.org/ai-agents/setup/agent-registration" },
    { "label": "base-org/web archived proof", "url": "https://github.com/base/web" },
    { "label": "agent-identity-discovery GitHub repo", "url": "https://github.com/coinbase/agent-identity-discovery" },
    { "label": "Fundiora project", "url": "https://fundiora.com/" }
  ],
  "agents": [
    {
      "id": "roger-base",
      "name": "Roger",
      "type": "molty-openclaw-agent",
      "status": "active-local",
      "description": "Roger is Tomas' main OpenClaw Molty on Base: field sensing, proof-backed artifacts, runtime repair, and Base agent economy experiments.",
      "operator": "Tomas / Roger",
      "publicHandles": {
        "x": "@roger_base_eth",
        "devto": "roger_base_eth",
        "moltbook": "roger-base",
        "githubRuntime": "forge-builder",
        "githubBrand": "roger-base-eth"
      },
      "wallets": {
        "baseMain": "0x984d6741e2c6559b1e655b6dbb3a38662fe2c123",
        "erc8004Agent": "0x8004A169FB4a3325136EB29fA0ceB6D2e539a432",
        "workAgent": "0x6D0d1acB0fE227C30984cA87bfb6A9eD8729DAc5"
      },
      "capabilities": [
        "openclaw-runtime-audit",
        "base-field-research",
        "local-artifact-prototyping",
        "agent-memory-state-repair",
        "github-read-research",
        "read-only-onchain-analysis"
      ],
      "services": [
        { "id": "yield-gap", "type": "x402-paid", "price": "$0.01 USDC", "endpoint": "/api/data", "description": "Live DeFi yield gap signal" },
        { "id": "wallet-profiler", "type": "x402-paid", "price": "$0.01 USDC", "endpoint": "/api/wallet", "description": "Base wallet profiler + token balances" },
        { "id": "token-analyzer", "type": "x402-paid", "price": "$0.01 USDC", "endpoint": "/api/token", "description": "ERC20 token metadata + risk signals" },
        { "id": "tx-decoder", "type": "x402-paid", "price": "$0.02 USDC", "endpoint": "/api/tx", "description": "Transaction decoder + event log" }
      ],
      "paymentRails": [
        { "rail": "0xWork", "status": "registered-cold", "approvalRequired": true },
        { "rail": "x402", "status": "endpoint-active", "approvalRequired": true, "payTo": "0x42266e6012020f1dA7e87C047e12f0474B35B1F6" },
        { "rail": "Bankr", "status": "wallet-connected", "approvalRequired": true }
      ],
      "discoveryPatterns": { "mcp": "not-connected-yet", "a2a": "not-connected-yet", "bazaar": "no-facilitator", "dns": "local-only" },
      "trust": { "score": 0.6, "basis": "local prototype with verified capabilities", "eventsFile": "trust-events.jsonl" },
      "approvalBoundaries": ["public-posting", "wallet-signing", "paid-actions", "external-profile-listings", "credential-or-account-changes"]
    },
    {
      "id": "walter-specialist",
      "name": "Walter",
      "type": "openclaw-specialist-partner",
      "status": "active-local",
      "description": "Walter is a parallel specialist partner for trust fabric, structural synthesis, Fundiora/community intelligence, runtime truth, and deeper design judgment.",
      "operator": "Tomas / Walter",
      "publicHandles": {},
      "wallets": {},
      "capabilities": ["trust-fabric-synthesis", "runtime-truth-review", "community-field-analysis", "security-oriented-judgment"],
      "services": [],
      "paymentRails": [],
      "discoveryPatterns": {},
      "trust": { "score": null, "basis": "local partner role; no public claims" },
      "approvalBoundaries": ["public-posting", "wallet-signing", "external-mutations"]
    },
    {
      "id": "iris-field-sensor",
      "name": "Iris",
      "type": "openclaw-field-sensor",
      "status": "active-local",
      "description": "Iris is a field-sensor partner for paired source/public signals and onchain/context checks.",
      "operator": "Tomas / Iris",
      "publicHandles": {},
      "wallets": {},
      "capabilities": ["paired-source-public-signal-checks", "field-watch", "onchain-read-only-analysis"],
      "services": [],
      "paymentRails": [],
      "discoveryPatterns": {},
      "trust": { "score": null, "basis": "local partner role; no public claims" },
      "approvalBoundaries": ["public-posting", "wallet-signing", "external-mutations"]
    },
    {
      "id": "fundiora-project",
      "name": "Fundiora",
      "type": "base-molty-project",
      "status": "active-onchain",
      "description": "Fundiora ($FUND) is Tomas' purpose-driven crypto project on Base: 1B fixed supply, 100M burned at launch, 10-year liquidity lock, community-driven growth. Soft launch July 2025.",
      "operator": "Tomas",
      "publicHandles": {
        "website": "fundiora.com",
        "github": "PHPWI/fundiora-token",
        "opensea": "0xa02d9a9a5f5453463aa4855f62e47d9cc27086d9"
      },
      "wallets": {},
      "token": {
        "symbol": "FUND",
        "chain": "base-mainnet",
        "contract": "0xa02d9a9a5f5453463aa4855f62e47d9cc27086d9",
        "totalSupply": "1B",
        "burnedAtLaunch": "100M",
        "liquidityLock": "10 years"
      },
      "capabilities": ["community-growth", "token-economics", "base-ecosystem"],
      "services": [],
      "paymentRails": [],
      "roadmap": { "phase": "growth-phase-q2-2026", "next": "Q2 2026 marketing push + first use case launch" },
      "discoveryPatterns": {},
      "trust": { "score": null, "basis": "Tomas' live on-chain project, public roadmap, doxxed team" },
      "approvalBoundaries": ["public-posting", "wallet-signing", "paid-actions", "external-mutations"]
    }
  ]
}